{
  "schemaVersion": 1,
  "milestone": "M1",
  "updated": "2026-07-18",
  "implementationClaim": "none",
  "decisionGates": [
    { "id": "product.entity-time", "level": "product", "state": "backlog", "source": "docs/workshops/world-model-question-set.md#b-what-is-a-game-object" },
    { "id": "product.space-sdk", "level": "product", "state": "backlog", "source": "docs/workshops/world-model-question-set.md#d-how-do-space-and-maps-work" },
    { "id": "product.persistence-tooling", "level": "product", "state": "backlog", "source": "docs/workshops/world-model-question-set.md#f-saving-loading-and-change" },
    { "id": "technical.ownership", "level": "technical", "state": "backlog", "source": "docs/status/development-plan.md#technical-decision-gates-accepted-just-ahead-of-the-work-they-govern" },
    { "id": "technical.sdk-topology", "level": "technical", "state": "backlog", "source": "docs/status/development-plan.md#technical-decision-gates-accepted-just-ahead-of-the-work-they-govern" },
    { "id": "technical.entity-runtime", "level": "technical", "state": "backlog", "source": "docs/status/development-plan.md#technical-decision-gates-accepted-just-ahead-of-the-work-they-govern" },
    { "id": "technical.simulation-time", "level": "technical", "state": "backlog", "source": "docs/status/development-plan.md#technical-decision-gates-accepted-just-ahead-of-the-work-they-govern" },
    { "id": "technical.space", "level": "technical", "state": "backlog", "source": "docs/status/development-plan.md#technical-decision-gates-accepted-just-ahead-of-the-work-they-govern" },
    { "id": "technical.identity-content", "level": "technical", "state": "backlog", "source": "docs/status/development-plan.md#technical-decision-gates-accepted-just-ahead-of-the-work-they-govern" },
    { "id": "technical.delivery", "level": "technical", "state": "backlog", "source": "docs/status/development-plan.md#technical-decision-gates-accepted-just-ahead-of-the-work-they-govern" },
    { "id": "technical.network", "level": "technical", "state": "backlog", "source": "docs/status/development-plan.md#technical-decision-gates-accepted-just-ahead-of-the-work-they-govern" },
    { "id": "technical.creator-workflow", "level": "technical", "state": "backlog", "source": "docs/status/development-plan.md#technical-decision-gates-accepted-just-ahead-of-the-work-they-govern" }
  ],
  "scenarios": [
    {
      "id": "external-interactive-networked-object",
      "title": "An external game authors one complete interactive object through supported contracts",
      "serves": ["0003"],
      "targetMilestone": "M4",
      "state": "specified",
      "sourceProofs": ["docs/decisions/product/0003-preserve-straightforward-game-authoring.md#how-we-will-prove-the-decision-works"],
      "actors": ["external game developer", "player"],
      "given": ["the game is outside the Robusta repository and consumes only published SDK artifacts"],
      "when": ["the developer adds an interactive object and the player uses it in a networked session"],
      "then": ["the object uses game-defined components, systems, prototype configuration, lifecycle and gameplay events, localization, appearance, entity-bound UI, and authoritative replication", "the game requires no Robusta source change, internal reference, or undocumented host hook", "generated registration and synchronization metadata is deterministic and inspectable"],
      "qualityFacets": ["supported-sdk", "external-use", "automated-tests", "inspection", "packaging"],
      "testNames": ["Robusta.Conformance.GameSdk.ExternalInteractiveNetworkedObject"],
      "openDecisionGates": ["product.entity-time", "product.space-sdk", "technical.sdk-topology", "technical.entity-runtime", "technical.identity-content", "technical.network"]
    },
    {
      "id": "side-by-side-games",
      "title": "Incompatible games and versions coexist without shared mutable state",
      "serves": ["0004"],
      "targetMilestone": "M5",
      "state": "specified",
      "sourceProofs": ["docs/decisions/product/0004-distribute-games-as-isolated-application-packages.md#how-we-will-prove-the-decision-works"],
      "actors": ["player", "server operator"],
      "given": ["two incompatible games and two versions of one game are installed"],
      "when": ["the installations are launched independently"],
      "then": ["each selected installation runs with its exact runtime and dependencies", "no installation observes mutable state belonging to another installation", "selecting one version does not rewrite or invalidate the other"],
      "qualityFacets": ["automated-tests", "packaging", "compatibility", "security"],
      "testNames": ["Robusta.Conformance.Delivery.SideBySideGamesAndVersions"],
      "openDecisionGates": ["technical.ownership", "technical.delivery"]
    },
    {
      "id": "interrupted-update",
      "title": "An interrupted update preserves the last usable installation",
      "serves": ["0004"],
      "targetMilestone": "M5",
      "state": "specified",
      "sourceProofs": ["docs/decisions/product/0004-distribute-games-as-isolated-application-packages.md#how-we-will-prove-the-decision-works"],
      "actors": ["player", "server operator"],
      "given": ["a usable game installation exists and an update is available"],
      "when": ["the update is interrupted at each durable transition point"],
      "then": ["the prior installation remains selectable and usable", "incomplete material is never presented as the completed release", "the operator can return to the prior exact receipt"],
      "qualityFacets": ["automated-tests", "packaging", "compatibility"],
      "testNames": ["Robusta.Conformance.Delivery.InterruptedUpdatePreservesPriorRelease"],
      "openDecisionGates": ["technical.delivery"]
    },
    {
      "id": "launcher-process-load-audit",
      "title": "Delivery processes do not acquire undeclared game execution authority",
      "serves": ["0004"],
      "targetMilestone": "M5",
      "state": "specified",
      "sourceProofs": ["docs/decisions/product/0004-distribute-games-as-isolated-application-packages.md#how-we-will-prove-the-decision-works"],
      "actors": ["security reviewer", "player"],
      "given": ["a launcher manages a game with distinct client and server material"],
      "when": ["the launcher and produced client package are audited"],
      "then": ["the launcher process has not loaded managed game assemblies", "the client package contains no server-only assembly or resource"],
      "qualityFacets": ["automated-tests", "packaging", "security"],
      "testNames": ["Robusta.Conformance.Delivery.LauncherAndClientLoadBoundary"],
      "openDecisionGates": ["technical.ownership", "technical.delivery"]
    },
    {
      "id": "catalog-reproducibility",
      "title": "Exact inputs produce one normalized catalog",
      "serves": ["0005"],
      "targetMilestone": "M3",
      "state": "specified",
      "sourceProofs": ["docs/decisions/product/0005-compile-readable-content.md#how-we-will-prove-the-decision-works"],
      "actors": ["game developer", "release engineer"],
      "given": ["two clean supported machines receive identical source and the same exact dependency lock"],
      "when": ["each machine compiles the content catalog"],
      "then": ["their normalized catalog outputs and fingerprints are identical", "machine-specific paths, culture, ordering, and timestamps do not affect the result"],
      "qualityFacets": ["automated-tests", "packaging", "compatibility"],
      "testNames": ["Robusta.Conformance.Content.CatalogReproducibility"],
      "openDecisionGates": ["technical.identity-content"]
    },
    {
      "id": "source-diagnostic",
      "title": "Invalid content reports stable source-quality diagnostics before launch",
      "serves": ["0005"],
      "targetMilestone": "M3",
      "state": "specified",
      "sourceProofs": ["docs/decisions/product/0005-compile-readable-content.md#how-we-will-prove-the-decision-works"],
      "actors": ["game developer"],
      "given": ["content contains an invalid reference or undeclared cross-package override"],
      "when": ["the normal development or release build validates the content"],
      "then": ["the build fails before launch", "the diagnostic has a stable identity and reports the original file, location, offending identity, and corrective context"],
      "qualityFacets": ["diagnostics", "automated-tests", "documentation"],
      "testNames": ["Robusta.Conformance.Content.SourceDiagnostic"],
      "openDecisionGates": ["technical.identity-content"]
    },
    {
      "id": "resolved-inspection",
      "title": "A developer can inspect resolved content and its provenance",
      "serves": ["0005"],
      "targetMilestone": "M3",
      "state": "specified",
      "sourceProofs": ["docs/decisions/product/0005-compile-readable-content.md#how-we-will-prove-the-decision-works"],
      "actors": ["game developer", "migration reviewer"],
      "given": ["a catalog uses inheritance, patches, and two packages with the same local definition name"],
      "when": ["the developer inspects a resolved definition and a migration assessment"],
      "then": ["inspection shows final component values, inheritance, package source, and applied patches", "package-qualified identities remain distinct", "imported legacy content is classified as exact, converted with warning, manual, or unsupported"],
      "qualityFacets": ["diagnostics", "inspection", "compatibility"],
      "testNames": ["Robusta.Conformance.Content.ResolvedCatalogInspection"],
      "openDecisionGates": ["product.persistence-tooling", "technical.identity-content"]
    },
    {
      "id": "two-client-network-fault-matrix",
      "title": "Two clients remain governed by server authority under network faults",
      "serves": ["0006"],
      "targetMilestone": "M4",
      "state": "specified",